{
  "access_events": [
    {
      "bytes_consumed": 25464,
      "candidate_id": "G2CAND-NOR-DOMSTOL-AR-2025",
      "edition_id": "ED-NOR-DOMSTOL-AR-2025",
      "ended_at": "2026-08-15T06:55:53.284Z",
      "forbidden_access": false,
      "method": "GET",
      "redirect_location": null,
      "requested_url": "https://www.domstol.no/no/domstoladministrasjonen/publikasjoner/arsmeldingar/",
      "response_content_type": "text/html",
      "response_status": 200,
      "started_at": "2026-08-15T06:55:50.756Z",
      "status": "html_metadata_resolved"
    },
    {
      "bytes_consumed": 0,
      "candidate_id": "G2CAND-PER-PJ-LALIBERTAD-BULLETIN-01-2024",
      "edition_id": "ED-PER-PJ-LALIBERTAD-BULLETIN-01-2024",
      "ended_at": "2026-08-15T06:55:53.285Z",
      "forbidden_access": false,
      "method": "GET",
      "redirect_location": null,
      "requested_url": "https://www.pj.gob.pe/wps/wcm/connect/Corte Superior La Libertad PJ/s_csj_LaLibertad_nuevo/as_corte_superior_LaLibertad/as_presidencia/as_documentos/as_resoluciones_administrativas/as_2024/?WCM_PI=1&WCM_Page.dcd566804ddc2df4838cdbcdee6548b3=47",
      "response_content_type": null,
      "response_status": null,
      "started_at": "2026-08-15T06:55:53.284Z",
      "status": "request_error"
    },
    {
      "bytes_consumed": 69245,
      "candidate_id": "G2CAND-GBR-EAW-CAFCASS-ARA-2024-25",
      "edition_id": "ED-GBR-EAW-CAFCASS-ARA-2024-25",
      "ended_at": "2026-08-15T06:55:54.789Z",
      "forbidden_access": false,
      "method": "GET",
      "redirect_location": null,
      "requested_url": "https://www.gov.uk/government/publications/cafcass-annual-report-and-accounts-2024-to-2025",
      "response_content_type": "text/html",
      "response_status": 200,
      "started_at": "2026-08-15T06:55:53.285Z",
      "status": "html_metadata_resolved"
    },
    {
      "bytes_consumed": 45892,
      "candidate_id": "G2CAND-AUS-VIC-MCV-AR-2024-25",
      "edition_id": "ED-AUS-VIC-MCV-AR-2024-25",
      "ended_at": "2026-08-15T06:55:55.424Z",
      "forbidden_access": false,
      "method": "GET",
      "redirect_location": null,
      "requested_url": "https://www.mcv.vic.gov.au/news-and-resources/publications/annual-report-2024-2025",
      "response_content_type": "text/html",
      "response_status": 200,
      "started_at": "2026-08-15T06:55:54.789Z",
      "status": "html_metadata_resolved"
    },
    {
      "bytes_consumed": 38394,
      "candidate_id": "G2CAND-GBR-NIR-NICTS-INFOGRAPHIC-2023",
      "edition_id": "ED-GBR-NIR-NICTS-INFOGRAPHIC-2023",
      "ended_at": "2026-08-15T06:55:56.664Z",
      "forbidden_access": false,
      "method": "GET",
      "redirect_location": null,
      "requested_url": "https://www.justice-ni.gov.uk/publications/nicts-judicial-statistics",
      "response_content_type": "text/html",
      "response_status": 200,
      "started_at": "2026-08-15T06:55:55.424Z",
      "status": "html_metadata_resolved"
    },
    {
      "bytes_consumed": 0,
      "candidate_id": "G2CAND-AUS-NSW-LOCAL-AR-2024",
      "edition_id": "ED-AUS-NSW-LOCAL-AR-2024",
      "ended_at": "2026-08-15T06:55:56.739Z",
      "forbidden_access": false,
      "method": "GET",
      "redirect_location": "https://localcourt.nsw.gov.au/errors/404.html",
      "requested_url": "https://localcourt.nsw.gov.au/practice-publications/publications/annual-reviews.html",
      "response_content_type": "text/html",
      "response_status": 302,
      "started_at": "2026-08-15T06:55:56.664Z",
      "status": "redirect_blocked"
    },
    {
      "bytes_consumed": 0,
      "candidate_id": "G2CAND-DNK-COURTS-NATIONAL-AR-2024",
      "edition_id": "ED-DNK-COURTS-NATIONAL-AR-2024",
      "ended_at": "2026-08-15T06:55:57.592Z",
      "forbidden_access": false,
      "method": "GET",
      "redirect_location": null,
      "requested_url": "https://www.domstol.dk/om-os/aarsrapporter/",
      "response_content_type": "text/html",
      "response_status": 403,
      "started_at": "2026-08-15T06:55:56.739Z",
      "status": "http_error"
    },
    {
      "bytes_consumed": 173757,
      "candidate_id": "G2CAND-NLD-RECHTSPRAAK-OVERIJSSEL-AR-2024",
      "edition_id": "ED-NLD-RECHTSPRAAK-OVERIJSSEL-AR-2024",
      "ended_at": "2026-08-15T06:55:58.440Z",
      "forbidden_access": false,
      "method": "GET",
      "redirect_location": null,
      "requested_url": "https://www.rechtspraak.nl/organisatie-en-contact/organisatie/rechtbanken/rechtbank-overijssel/over-de-rechtbank/publicaties",
      "response_content_type": "text/html",
      "response_status": 200,
      "started_at": "2026-08-15T06:55:57.592Z",
      "status": "html_metadata_resolved"
    },
    {
      "bytes_consumed": 38394,
      "candidate_id": "G2CAND-GBR-NIR-NICTS-JUDSTAT-2025",
      "edition_id": "ED-GBR-NIR-NICTS-JUDSTAT-2025",
      "ended_at": "2026-08-15T06:55:58.494Z",
      "forbidden_access": false,
      "method": "GET",
      "redirect_location": null,
      "requested_url": "https://www.justice-ni.gov.uk/publications/nicts-judicial-statistics",
      "response_content_type": "text/html",
      "response_status": 200,
      "started_at": "2026-08-15T06:55:58.440Z",
      "status": "html_metadata_resolved"
    },
    {
      "bytes_consumed": 110484,
      "candidate_id": "G2CAND-ESP-CGPJ-KEYIND-2024",
      "edition_id": "ED-ESP-CGPJ-KEYIND-2024",
      "ended_at": "2026-08-15T06:56:02.272Z",
      "forbidden_access": false,
      "method": "GET",
      "redirect_location": null,
      "requested_url": "https://www.poderjudicial.es/cgpj/es/Temas/Estadistica-Judicial/Estudios-e-Informes/Indicadores-Clave/Indicadores-clave-del-conjunto-de-las-jurisdicciones----Anual-Trimestre-2024",
      "response_content_type": "text/html",
      "response_status": 200,
      "started_at": "2026-08-15T06:55:58.494Z",
      "status": "html_metadata_resolved"
    },
    {
      "bytes_consumed": 0,
      "candidate_id": "G2CAND-USA-TX-STATEWIDE-FAMILY-FY24",
      "edition_id": "ED-USA-TX-STATEWIDE-FAMILY-FY24",
      "ended_at": "2026-08-15T06:56:02.588Z",
      "forbidden_access": false,
      "method": "GET",
      "redirect_location": null,
      "requested_url": "https://www.txcourts.gov/statistics/annual-statistical-reports/2024/",
      "response_content_type": "text/html",
      "response_status": 403,
      "started_at": "2026-08-15T06:56:02.273Z",
      "status": "http_error"
    },
    {
      "bytes_consumed": 53147,
      "candidate_id": "G2CAND-KOR-SCOURT-JUDICIAL-YEARBOOK-2024",
      "edition_id": "ED-KOR-SCOURT-JUDICIAL-YEARBOOK-2024",
      "ended_at": "2026-08-15T06:56:04.721Z",
      "forbidden_access": false,
      "method": "GET",
      "redirect_location": null,
      "requested_url": "https://www.scourt.go.kr/portal/news/NewsViewAction.work?gubun=6&seqnum=2696",
      "response_content_type": "text/html",
      "response_status": 200,
      "started_at": "2026-08-15T06:56:02.588Z",
      "status": "html_metadata_inspected_no_exact_candidate_pdf"
    },
    {
      "bytes_consumed": 21770,
      "candidate_id": "G2CAND-PER-PJ-ONAJUP-BULLETIN-JJA-2024",
      "edition_id": "ED-PER-PJ-ONAJUP-BULLETIN-JJA-2024",
      "ended_at": "2026-08-15T06:56:09.383Z",
      "forbidden_access": false,
      "method": "GET",
      "redirect_location": null,
      "requested_url": "https://www.pj.gob.pe/wps/wcm/connect/onajup/s_onajup/as_documentos/as_documentos?WCM_PI=1&WCM_Page.8602c10048781bfa9f489f50d8336ffa=2",
      "response_content_type": "text/html",
      "response_status": 200,
      "started_at": "2026-08-15T06:56:04.721Z",
      "status": "html_metadata_inspected_no_exact_candidate_pdf"
    },
    {
      "bytes_consumed": 25464,
      "candidate_id": "G2CAND-NOR-DOMSTOL-LIVET-2025",
      "edition_id": "ED-NOR-DOMSTOL-LIVET-2025",
      "ended_at": "2026-08-15T06:56:10.579Z",
      "forbidden_access": false,
      "method": "GET",
      "redirect_location": null,
      "requested_url": "https://www.domstol.no/no/domstoladministrasjonen/publikasjoner/arsmeldingar/",
      "response_content_type": "text/html",
      "response_status": 200,
      "started_at": "2026-08-15T06:56:09.383Z",
      "status": "html_metadata_resolved"
    },
    {
      "bytes_consumed": 32400,
      "candidate_id": "G2CAND-BEL-SPF-JUSTICE-AR-2024",
      "edition_id": "ED-BEL-SPF-JUSTICE-AR-2024",
      "ended_at": "2026-08-15T06:56:12.327Z",
      "forbidden_access": false,
      "method": "GET",
      "redirect_location": null,
      "requested_url": "https://justice.belgium.be/fr/publications/rapport_annuel_2024",
      "response_content_type": "text/html",
      "response_status": 200,
      "started_at": "2026-08-15T06:56:10.580Z",
      "status": "html_metadata_resolved"
    },
    {
      "bytes_consumed": 231008,
      "candidate_id": "G2CAND-SGP-COURTS-AR-2024",
      "edition_id": "ED-SGP-COURTS-AR-2024",
      "ended_at": "2026-08-15T06:56:13.364Z",
      "forbidden_access": false,
      "method": "GET",
      "redirect_location": null,
      "requested_url": "https://www.judiciary.gov.sg/news-and-resources/publications/publication-details/sg-courts-annual-report-2024",
      "response_content_type": "text/html",
      "response_status": 200,
      "started_at": "2026-08-15T06:56:12.327Z",
      "status": "html_metadata_resolved"
    },
    {
      "bytes_consumed": 62789,
      "candidate_id": "G2CAND-FRA-MJ-LOPJ-REPORT-2024",
      "edition_id": "ED-FRA-MJ-LOPJ-REPORT-2024",
      "ended_at": "2026-08-15T06:56:15.225Z",
      "forbidden_access": false,
      "method": "GET",
      "redirect_location": null,
      "requested_url": "https://www.justice.gouv.fr/documentation/ressources/rapport-2024-loi-dorientation-programmation-du-ministere-justice-2023-2027",
      "response_content_type": "text/html",
      "response_status": 200,
      "started_at": "2026-08-15T06:56:13.364Z",
      "status": "html_metadata_resolved"
    },
    {
      "bytes_consumed": 156922,